{"$schema":"https://json-schema.org/draft/2020-12/schema","$id":"https://narratwin.local/schemas/cut-taxonomy-v2.schema.json","title":"CutTaxonomyV2","type":"object","additionalProperties":false,"required":["schemaVersion","taxonomyId","proposalState","effectiveAt","engineeringStages","productModes","cuts","cutDependencySemantics","cut5CapabilityDependencies","laneA","historicalCheckpoints","adrPlans","digitalTwinSequence","legacyAliases","compatibilityMigration","activation"],"properties":{"schemaVersion":{"const":"CutTaxonomyV2"},"taxonomyId":{"const":"narratwin-six-cut-taxonomy-v2"},"proposalState":{"const":"PROPOSED"},"effectiveAt":{"type":"null"},"engineeringStages":{"type":"array","minItems":10,"maxItems":10,"uniqueItems":true,"items":{"$ref":"#/$defs/engineeringStage"}},"productModes":{"type":"array","minItems":2,"maxItems":2,"uniqueItems":true,"items":{"$ref":"#/$defs/namedItem"}},"cuts":{"type":"array","minItems":6,"maxItems":6,"uniqueItems":true,"items":{"$ref":"#/$defs/cut"}},"cutDependencySemantics":{"const":"CUT_COMPLETION_PREREQUISITES"},"cut5CapabilityDependencies":{"type":"array","minItems":5,"maxItems":5,"uniqueItems":true,"items":{"$ref":"#/$defs/cut5CapabilityDependency"}},"laneA":{"type":"array","minItems":8,"maxItems":8,"uniqueItems":true,"items":{"$ref":"#/$defs/laneTask"}},"historicalCheckpoints":{"type":"array","minItems":5,"maxItems":5,"uniqueItems":true,"items":{"$ref":"#/$defs/checkpoint"}},"adrPlans":{"type":"array","minItems":2,"maxItems":2,"uniqueItems":true,"items":{"$ref":"#/$defs/adrPlan"}},"digitalTwinSequence":{"type":"array","minItems":8,"maxItems":8,"uniqueItems":true,"items":{"$ref":"#/$defs/digitalTwinStep"}},"legacyAliases":{"type":"array","minItems":1,"maxItems":1,"items":{"$ref":"#/$defs/legacyAlias"}},"compatibilityMigration":{"$ref":"#/$defs/compatibilityMigration"},"activation":{"$ref":"#/$defs/activation"}},"$defs":{"namedItem":{"type":"object","additionalProperties":false,"required":["id","name"],"properties":{"id":{"type":"string","minLength":2},"name":{"type":"string","minLength":2}}},"engineeringStage":{"type":"object","additionalProperties":false,"required":["id","name","productImplementationAllowed"],"properties":{"id":{"type":"string","pattern":"^(Stage[0-8]|FinalReview)$"},"name":{"type":"string","minLength":2},"productImplementationAllowed":{"type":"boolean"}}},"cut":{"type":"object","additionalProperties":false,"required":["id","name","dependsOn"],"properties":{"id":{"type":"string","pattern":"^Cut[1-6]$"},"name":{"type":"string","minLength":2},"dependsOn":{"type":"array","uniqueItems":true,"items":{"type":"string","pattern":"^Cut[1-6]$"}}}},"cut5CapabilityDependency":{"type":"object","additionalProperties":false,"required":["id","minimumStep","requiresCuts","requiredForCut5Completion"],"properties":{"id":{"enum":["PREPARED_ENGLISH","SCREEN_GUIDED","MULTILINGUAL_PREPARED","GROUNDED_REALTIME","EXPANDED_MOTION"]},"minimumStep":{"type":"string","pattern":"^DT[0-7]$"},"requiresCuts":{"type":"array","minItems":1,"uniqueItems":true,"items":{"type":"string","pattern":"^Cut[1-6]$"}},"requiredForCut5Completion":{"type":"boolean"}}},"digitalTwinStep":{"type":"object","additionalProperties":false,"required":["id","name","dependsOnSteps"],"properties":{"id":{"type":"string","pattern":"^DT[0-7]$"},"name":{"type":"string","minLength":2},"dependsOnSteps":{"type":"array","uniqueItems":true,"items":{"type":"string","pattern":"^DT[0-7]$"}}}},"laneTask":{"type":"object","additionalProperties":false,"required":["id","state"],"properties":{"id":{"type":"string","pattern":"^T0[1-8]$"},"state":{"enum":["COMPLETE","INCOMPLETE"]}}},"checkpoint":{"type":"object","additionalProperties":false,"required":["id","v2Destinations"],"properties":{"id":{"type":"string","pattern":"^Checkpoint(1|2|3A|3B|3C)$"},"v2Destinations":{"type":"array","minItems":1,"uniqueItems":true,"items":{"type":"string","pattern":"^Cut[1-6]$"}}}},"adrPlan":{"type":"object","additionalProperties":false,"required":["id","name","state"],"properties":{"id":{"type":"string","pattern":"^ADR0079Plan[AB]$"},"name":{"type":"string","minLength":2},"state":{"enum":["RESEARCH","RESEARCH_CONTRACT_AMENDMENT_REQUIRED"]}}},"legacyAlias":{"type":"object","additionalProperties":false,"required":["alias","historicalMeaning","canonicalCut","canSatisfyNewCut5","cut6MigrationValidationRequired","legacyEvidenceDefaultState"],"properties":{"alias":{"const":"LegacyCut5Enterprise"},"historicalMeaning":{"const":"Enterprise and commercial readiness"},"canonicalCut":{"const":"Cut6"},"canSatisfyNewCut5":{"const":false},"cut6MigrationValidationRequired":{"const":true},"legacyEvidenceDefaultState":{"const":"UNMIGRATED"}}},"compatibilityMigration":{"type":"object","additionalProperties":false,"required":["migrationId","candidateState","atomicity","effectiveTimeSource","requiredSurfaces","postEffectiveLegacyReferencePolicy"],"properties":{"migrationId":{"const":"legacy-cut5-enterprise-to-cut6-v1"},"candidateState":{"const":"PENDING_ACCEPTED_CURRENT_TRANSITION"},"atomicity":{"const":"ALL_REQUIRED_SURFACES_OR_NONE"},"effectiveTimeSource":{"const":"ACCEPTED_CURRENT_TRANSITION_MERGED_AT"},"requiredSurfaces":{"type":"array","minItems":7,"maxItems":7,"uniqueItems":true,"items":{"enum":["SCHEMA_VERSIONS","ROADMAP_REFERENCES","STATUS_RECORDS","TESTS","ISSUE_TEMPLATES","COMPLETION_EVENTS","TRACEABILITY_RECORDS"]}},"postEffectiveLegacyReferencePolicy":{"const":"TYPED_SCHEMA_VERSION_OR_LEGACY_ALIAS_REQUIRED"}}},"activation":{"type":"object","additionalProperties":false,"required":["authority","v1RemainsEffective","candidatePresenceActivates","requiresSeparateAcceptedCurrentTransition"],"properties":{"authority":{"const":"NONE"},"v1RemainsEffective":{"const":true},"candidatePresenceActivates":{"const":false},"requiresSeparateAcceptedCurrentTransition":{"const":true}}}}}
