{"schemaVersion":"CutTaxonomyV2","taxonomyId":"narratwin-six-cut-taxonomy-v2","proposalState":"PROPOSED","effectiveAt":null,"engineeringStages":[{"id":"Stage0","name":"Codex operating model and skill lock","productImplementationAllowed":false},{"id":"Stage1","name":"Product strategy and PRD v1.0","productImplementationAllowed":false},{"id":"Stage2","name":"Architecture, security, AI safety","productImplementationAllowed":false},{"id":"Stage3","name":"Repository foundation and CI/CD quality gates","productImplementationAllowed":false},{"id":"Stage4","name":"Project upload to grounded script generation","productImplementationAllowed":true},{"id":"Stage5","name":"Evaluations, guardrails, observability","productImplementationAllowed":true},{"id":"Stage6","name":"Multilingual scripts, subtitles, voice adapter","productImplementationAllowed":true},{"id":"Stage7","name":"Avatar rendering adapter and export","productImplementationAllowed":true},{"id":"Stage8","name":"Performance, security hardening, release readiness","productImplementationAllowed":true},{"id":"FinalReview","name":"Independent release review","productImplementationAllowed":false}],"productModes":[{"id":"ProductMode1","name":"Prepared pre-rendered walkthrough"},{"id":"ProductMode2","name":"Grounded interactive Q&A"}],"cuts":[{"id":"Cut1","name":"Fictional English prepared walkthrough","dependsOn":[]},{"id":"Cut2","name":"Multilingual prepared walkthrough","dependsOn":["Cut1"]},{"id":"Cut3","name":"Grounded realtime Q&A","dependsOn":["Cut1"]},{"id":"Cut4","name":"Rich motion, real scenes, and provider portability","dependsOn":["Cut1"]},{"id":"Cut5","name":"Owner personal Digital Twin","dependsOn":["Cut1","Cut2","Cut3"]},{"id":"Cut6","name":"Enterprise and commercial readiness","dependsOn":["Cut1","Cut2","Cut3","Cut4","Cut5"]}],"cutDependencySemantics":"CUT_COMPLETION_PREREQUISITES","cut5CapabilityDependencies":[{"id":"PREPARED_ENGLISH","minimumStep":"DT4","requiresCuts":["Cut1"],"requiredForCut5Completion":true},{"id":"SCREEN_GUIDED","minimumStep":"DT5","requiresCuts":["Cut1"],"requiredForCut5Completion":true},{"id":"MULTILINGUAL_PREPARED","minimumStep":"DT5","requiresCuts":["Cut1","Cut2"],"requiredForCut5Completion":true},{"id":"GROUNDED_REALTIME","minimumStep":"DT6","requiresCuts":["Cut1","Cut3"],"requiredForCut5Completion":true},{"id":"EXPANDED_MOTION","minimumStep":"DT4","requiresCuts":["Cut1","Cut4"],"requiredForCut5Completion":false}],"laneA":[{"id":"T01","state":"COMPLETE"},{"id":"T02","state":"COMPLETE"},{"id":"T03","state":"COMPLETE"},{"id":"T04","state":"COMPLETE"},{"id":"T05","state":"COMPLETE"},{"id":"T06","state":"INCOMPLETE"},{"id":"T07","state":"INCOMPLETE"},{"id":"T08","state":"INCOMPLETE"}],"historicalCheckpoints":[{"id":"Checkpoint1","v2Destinations":["Cut1"]},{"id":"Checkpoint2","v2Destinations":["Cut5"]},{"id":"Checkpoint3A","v2Destinations":["Cut1"]},{"id":"Checkpoint3B","v2Destinations":["Cut5"]},{"id":"Checkpoint3C","v2Destinations":["Cut5"]}],"adrPlans":[{"id":"ADR0079PlanA","name":"Continuous presenter","state":"RESEARCH"},{"id":"ADR0079PlanB","name":"Editorial hybrid","state":"RESEARCH_CONTRACT_AMENDMENT_REQUIRED"}],"digitalTwinSequence":[{"id":"DT0","name":"Plan and threat model","dependsOnSteps":[]},{"id":"DT1","name":"Provider, terms, privacy, and restricted store","dependsOnSteps":["DT0"]},{"id":"DT2","name":"Consent, identity, liveness, and capture","dependsOnSteps":["DT1"]},{"id":"DT3","name":"Separate face and voice enrollment and deletion rehearsal","dependsOnSteps":["DT2"]},{"id":"DT4","name":"Private 29.494-second English prepared output","dependsOnSteps":["DT3"]},{"id":"DT5","name":"Full prepared, screen-guided, multilingual output","dependsOnSteps":["DT4"]},{"id":"DT6","name":"Grounded realtime Digital Twin","dependsOnSteps":["DT5"]},{"id":"DT7","name":"Invite-only use and Cut 6 handoff","dependsOnSteps":["DT6"]}],"legacyAliases":[{"alias":"LegacyCut5Enterprise","historicalMeaning":"Enterprise and commercial readiness","canonicalCut":"Cut6","canSatisfyNewCut5":false,"cut6MigrationValidationRequired":true,"legacyEvidenceDefaultState":"UNMIGRATED"}],"compatibilityMigration":{"migrationId":"legacy-cut5-enterprise-to-cut6-v1","candidateState":"PENDING_ACCEPTED_CURRENT_TRANSITION","atomicity":"ALL_REQUIRED_SURFACES_OR_NONE","effectiveTimeSource":"ACCEPTED_CURRENT_TRANSITION_MERGED_AT","requiredSurfaces":["SCHEMA_VERSIONS","ROADMAP_REFERENCES","STATUS_RECORDS","TESTS","ISSUE_TEMPLATES","COMPLETION_EVENTS","TRACEABILITY_RECORDS"],"postEffectiveLegacyReferencePolicy":"TYPED_SCHEMA_VERSION_OR_LEGACY_ALIAS_REQUIRED"},"activation":{"authority":"NONE","v1RemainsEffective":true,"candidatePresenceActivates":false,"requiresSeparateAcceptedCurrentTransition":true}}
